{
  "$schema": "https://json-schema.org/draft/2020-12/schema",
  "title": "DiagramGraph",
  "description": "Schema for a schematic graph",
  "type": "object",
  "properties": {
    "diagram_type": {
      "type": "string",
      "description": "The type of diagram"
    },
    "nodes": {
      "type": "array",
      "items": {
        "properties": {
          "metadata": {
            "anyOf": [
              {
                "additionalProperties": true,
                "type": "object"
              },
              {
                "type": "null"
              }
            ],
            "default": null,
            "description": "Node metadata",
            "title": "Metadata"
          },
          "bounding_box": {
            "anyOf": [
              {
                "items": {},
                "type": "array"
              },
              {
                "type": "null"
              }
            ],
            "default": null,
            "description": "Node bounding_box",
            "title": "Bounding Box"
          },
          "id": {
            "description": "Node id",
            "title": "Id",
            "type": "string"
          },
          "label": {
            "description": "Node label",
            "title": "Label",
            "type": "string"
          },
          "confidence": {
            "anyOf": [
              {
                "type": "string"
              },
              {
                "type": "null"
              }
            ],
            "default": null,
            "description": "Node confidence",
            "title": "Confidence"
          },
          "parent_id": {
            "anyOf": [
              {
                "type": "string"
              },
              {
                "type": "null"
              }
            ],
            "default": null,
            "description": "Node parent_id",
            "title": "Parent Id"
          }
        },
        "required": [
          "id",
          "label"
        ],
        "title": "GraphNode",
        "type": "object"
      },
      "description": "List of graph nodes"
    },
    "edges": {
      "type": "array",
      "items": {
        "properties": {
          "target": {
            "description": "Edge target",
            "title": "Target",
            "type": "string"
          },
          "source": {
            "description": "Edge source",
            "title": "Source",
            "type": "string"
          },
          "id": {
            "description": "Edge id",
            "title": "Id",
            "type": "string"
          },
          "label": {
            "anyOf": [
              {
                "type": "string"
              },
              {
                "type": "null"
              }
            ],
            "default": null,
            "description": "Edge label",
            "title": "Label"
          },
          "confidence": {
            "anyOf": [
              {
                "type": "string"
              },
              {
                "type": "null"
              }
            ],
            "default": null,
            "description": "Edge confidence",
            "title": "Confidence"
          }
        },
        "required": [
          "target",
          "source",
          "id"
        ],
        "title": "GraphEdge",
        "type": "object"
      },
      "description": "List of graph edges"
    },
    "flows": {
      "type": "array",
      "items": {
        "type": "object",
        "properties": {
          "id": {
            "type": "string",
            "description": "Flow identifier"
          },
          "label": {
            "type": "string",
            "description": "Human-readable flow name"
          },
          "node_ids": {
            "type": "array",
            "items": {
              "type": "string"
            },
            "description": "Node IDs belonging to this flow"
          }
        },
        "required": [
          "id",
          "label",
          "node_ids"
        ]
      },
      "description": "Distinct flows (connected components) detected in the diagram"
    },
    "metadata": {
      "type": "object",
      "description": "Additional metadata about the graph",
      "properties": {
        "page_info": {
          "type": "object",
          "description": "Page-level metadata (title, author, date, version)",
          "properties": {
            "title": {
              "type": "string"
            },
            "author": {
              "type": "string"
            },
            "date": {
              "type": "string"
            },
            "version": {
              "type": "string"
            }
          }
        },
        "legend": {
          "type": "array",
          "description": "Legend entries mapping symbols to meanings",
          "items": {
            "type": "object",
            "properties": {
              "symbol": {
                "type": "string"
              },
              "meaning": {
                "type": "string"
              }
            }
          }
        }
      }
    }
  },
  "required": [
    "diagram_type",
    "nodes",
    "edges"
  ]
}