{
  "diagram_type": "schematic",
  "nodes": [
    {
      "metadata": {
        "project_code": "RP100021",
        "date": "17Apr12"
      },
      "bounding_box": [
        900,
        863,
        937,
        900
      ],
      "id": "title_block",
      "label": "Raspberry Pi Schematic R1.0",
      "confidence": "high",
      "flow_id": "flow_1"
    },
    {
      "id": "J1",
      "bounding_box": [
        339,
        56,
        367,
        99
      ],
      "metadata": {
        "part_number": "PD-USB/112"
      },
      "confidence": "high",
      "label": "MICRO USB TYPE B",
      "flow_id": "flow_1"
    },
    {
      "label": "Fuse miniSMD",
      "confidence": "high",
      "bounding_box": [
        354,
        146,
        367,
        157
      ],
      "metadata": {
        "type": "miniSMD"
      },
      "id": "F1",
      "flow_id": "flow_1"
    },
    {
      "bounding_box": [
        343,
        208,
        351,
        223
      ],
      "label": "TP1",
      "confidence": "high",
      "id": "TP1",
      "flow_id": "flow_1"
    },
    {
      "metadata": {
        "value": "100n"
      },
      "bounding_box": [
        297,
        345,
        304,
        359
      ],
      "id": "C54",
      "label": "100n",
      "confidence": "high",
      "flow_id": "flow_2"
    },
    {
      "label": "100n",
      "confidence": "high",
      "metadata": {
        "value": "100n"
      },
      "bounding_box": [
        297,
        377,
        304,
        391
      ],
      "id": "C94",
      "flow_id": "flow_2"
    },
    {
      "metadata": {
        "value": "100n"
      },
      "bounding_box": [
        297,
        410,
        304,
        424
      ],
      "id": "C60",
      "label": "100n",
      "confidence": "high",
      "flow_id": "flow_2"
    },
    {
      "bounding_box": [
        362,
        377,
        367,
        391
      ],
      "label": "C91",
      "id": "C91",
      "confidence": "high",
      "flow_id": "flow_1"
    },
    {
      "label": "C57",
      "bounding_box": [
        362,
        410,
        367,
        424
      ],
      "id": "C57",
      "confidence": "high",
      "flow_id": "flow_1"
    },
    {
      "id": "BCM2835_OSC",
      "bounding_box": [
        70,
        730,
        208,
        795
      ],
      "metadata": {
        "part_number": "BCM2835"
      },
      "confidence": "high",
      "label": "BCM2835 OSC",
      "parent_id": "BCM2835_SoC",
      "flow_id": "flow_2"
    },
    {
      "bounding_box": [
        268,
        473,
        367,
        603
      ],
      "metadata": {
        "part_number": "BCM2835"
      },
      "id": "BCM2835_PWR1_SDRAM",
      "label": "BCM2835 PWR1 SDRAM",
      "confidence": "high",
      "parent_id": "BCM2835_SoC",
      "flow_id": "flow_2"
    },
    {
      "label": "BCM2835 PWR2",
      "confidence": "high",
      "bounding_box": [
        268,
        841,
        367,
        906
      ],
      "metadata": {
        "part_number": "BCM2835"
      },
      "id": "BCM2835_PWR2",
      "parent_id": "BCM2835_SoC",
      "flow_id": "flow_2"
    },
    {
      "confidence": "high",
      "label": "19M2 Crystal",
      "id": "X2",
      "bounding_box": [
        108,
        829,
        124,
        861
      ],
      "metadata": {
        "value": "19.2MHz"
      },
      "flow_id": "flow_2"
    },
    {
      "id": "C86",
      "bounding_box": [
        80,
        871,
        98,
        889
      ],
      "metadata": {
        "value": "27p"
      },
      "confidence": "high",
      "label": "27p",
      "flow_id": "flow_2"
    },
    {
      "id": "C74",
      "bounding_box": [
        135,
        871,
        153,
        889
      ],
      "metadata": {
        "value": "27p"
      },
      "confidence": "high",
      "label": "27p",
      "flow_id": "flow_2"
    },
    {
      "bounding_box": [
        300,
        929,
        310,
        943
      ],
      "metadata": {
        "value": "100n"
      },
      "id": "C89",
      "label": "100n",
      "confidence": "high",
      "flow_id": "flow_1"
    },
    {
      "confidence": "high",
      "metadata": {
        "value": "1A1 6V"
      },
      "id": "F3",
      "bounding_box": [
        241,
        133,
        278,
        170
      ],
      "label": "Fuse 1A1 6V",
      "flow_id": "flow_1"
    },
    {
      "confidence": "high",
      "metadata": {
        "value": "SMBJ 5V"
      },
      "id": "D17",
      "bounding_box": [
        281,
        183,
        319,
        221
      ],
      "label": "SMBJ 5V TVS",
      "flow_id": "flow_1"
    },
    {
      "confidence": "high",
      "metadata": {
        "value": "220uF"
      },
      "id": "C6",
      "bounding_box": [
        299,
        210,
        346,
        257
      ],
      "label": "220uF 6V3",
      "flow_id": "flow_1"
    },
    {
      "confidence": "high",
      "id": "R51",
      "metadata": {
        "value": "0R0"
      },
      "bounding_box": [
        269,
        86,
        336,
        153
      ],
      "label": "0R0",
      "flow_id": "flow_1"
    },
    {
      "label": "NCP1117-3v3 Regulator",
      "bounding_box": [
        328,
        98,
        436,
        206
      ],
      "confidence": "high",
      "metadata": {
        "part_number": "NCP1117-3v3"
      },
      "id": "RG2",
      "flow_id": "flow_1"
    },
    {
      "label": "100n",
      "bounding_box": [
        331,
        61,
        416,
        146
      ],
      "confidence": "high",
      "metadata": {
        "value": "100n"
      },
      "id": "C12",
      "flow_id": "flow_1"
    },
    {
      "label": "47u",
      "bounding_box": [
        382,
        162,
        461,
        241
      ],
      "confidence": "high",
      "metadata": {
        "value": "47u"
      },
      "id": "C11",
      "flow_id": "flow_1"
    },
    {
      "bounding_box": [
        401,
        197,
        475,
        271
      ],
      "label": "100n",
      "confidence": "high",
      "metadata": {
        "value": "100n"
      },
      "id": "C8",
      "flow_id": "flow_1"
    },
    {
      "confidence": "high",
      "metadata": {
        "value": "100n"
      },
      "id": "C80",
      "bounding_box": [
        297,
        399,
        415,
        415
      ],
      "label": "100n",
      "flow_id": "flow_1"
    },
    {
      "metadata": {
        "value": "240R"
      },
      "id": "R16",
      "confidence": "high",
      "bounding_box": [
        407,
        428,
        433,
        433
      ],
      "label": "240R ZQ",
      "flow_id": "flow_2"
    },
    {
      "id": "C3",
      "metadata": {
        "value": "100n"
      },
      "confidence": "high",
      "label": "100n",
      "bounding_box": [
        317,
        246,
        359,
        288
      ],
      "flow_id": "flow_1"
    },
    {
      "label": "1n0",
      "bounding_box": [
        307,
        292,
        403,
        307
      ],
      "id": "C2",
      "metadata": {
        "value": "1n0"
      },
      "confidence": "high",
      "flow_id": "flow_1"
    },
    {
      "confidence": "high",
      "metadata": {
        "value": "10n"
      },
      "id": "C10",
      "bounding_box": [
        417,
        230,
        490,
        303
      ],
      "label": "10n",
      "flow_id": "flow_1"
    },
    {
      "label": "10u",
      "bounding_box": [
        527,
        408,
        583,
        464
      ],
      "confidence": "high",
      "metadata": {
        "value": "10u"
      },
      "id": "C17",
      "flow_id": "flow_1"
    },
    {
      "id": "L5",
      "metadata": {
        "value": "1U0"
      },
      "confidence": "high",
      "label": "1U0 Inductor",
      "bounding_box": [
        638,
        690,
        707,
        707
      ],
      "flow_id": "flow_1"
    },
    {
      "confidence": "high",
      "metadata": {
        "value": "10u"
      },
      "id": "C16",
      "label": "10u",
      "bounding_box": [
        666,
        713,
        727,
        727
      ],
      "flow_id": "flow_1"
    },
    {
      "label": "LP2980-2v5 Regulator",
      "confidence": "high",
      "bounding_box": [
        377,
        85,
        511,
        219
      ],
      "metadata": {
        "part_number": "LP2980-2v5"
      },
      "id": "RG3",
      "flow_id": "flow_1"
    },
    {
      "confidence": "high",
      "label": "NCP1117-1v8 Regulator",
      "bounding_box": [
        432,
        85,
        566,
        219
      ],
      "metadata": {
        "part_number": "NCP1117-1v8"
      },
      "id": "RG1",
      "flow_id": "flow_1"
    },
    {
      "label": "10u",
      "confidence": "high",
      "id": "C15",
      "metadata": {
        "value": "10u"
      },
      "bounding_box": [
        441,
        158,
        528,
        245
      ],
      "flow_id": "flow_1"
    },
    {
      "confidence": "high",
      "label": "10n",
      "id": "C13",
      "metadata": {
        "value": "10n"
      },
      "bounding_box": [
        458,
        191,
        543,
        276
      ],
      "flow_id": "flow_1"
    },
    {
      "confidence": "high",
      "label": "100n",
      "id": "C62",
      "metadata": {
        "value": "100n"
      },
      "bounding_box": [
        571,
        443,
        629,
        501
      ],
      "flow_id": "flow_1"
    },
    {
      "confidence": "high",
      "label": "100K RUN Pull-up",
      "id": "R15",
      "metadata": {
        "value": "100K"
      },
      "bounding_box": [
        584,
        397,
        617,
        430
      ],
      "flow_id": "flow_1"
    },
    {
      "bounding_box": [
        685,
        671,
        797,
        685
      ],
      "id": "C65",
      "metadata": {
        "value": "220n"
      },
      "label": "220n",
      "confidence": "high",
      "flow_id": "flow_1"
    },
    {
      "label": "220n",
      "confidence": "high",
      "bounding_box": [
        717,
        703,
        797,